{
  "artifact_key": "src_9cbb508bb34760770e6f",
  "artifact_paths": {
    "canonical": "artifacts/pilot/src_9cbb508bb34760770e6f/canonical.json",
    "extraction": "artifacts/pilot/src_9cbb508bb34760770e6f/extraction.json",
    "review": "artifacts/review-queue/review_dafec09c419cf9fd4dc9.json",
    "validation": "artifacts/pilot/src_9cbb508bb34760770e6f/validation.json"
  },
  "created_at": "2026-08-12T14:00:38.704223Z",
  "decisions": {
    "classification": {
      "decided_at": null,
      "notes": "",
      "reviewer": null,
      "status": "pending"
    },
    "extraction": {
      "decided_at": null,
      "notes": "",
      "reviewer": null,
      "status": "pending"
    },
    "legal": {
      "decided_at": null,
      "notes": "",
      "reviewer": null,
      "status": "pending"
    },
    "privacy": {
      "decided_at": null,
      "notes": "",
      "reviewer": null,
      "status": "pending"
    },
    "sanitization": {
      "decided_at": null,
      "notes": "",
      "reviewer": null,
      "status": "pending"
    },
    "structure": {
      "decided_at": null,
      "notes": "",
      "reviewer": null,
      "status": "pending"
    }
  },
  "final_disposition": "pending",
  "initial_classification": "completed_contract",
  "required_reviews": [
    "classification",
    "extraction",
    "legal",
    "privacy",
    "sanitization",
    "structure"
  ],
  "review_coverage": "full",
  "review_record_id": "review_dafec09c419cf9fd4dc9",
  "reviewer": null,
  "revision": 0,
  "revision_history": [],
  "schema_version": "review-workspace-record-v1",
  "sources": [
    {
      "relative_path": "templates/Syria/نموذج عقد عمل فرد مع شركة.pdf",
      "sha256": "6f9c0484815baf2a3d85d22311158ee87af87bbf965b5c44cad42445c5095334",
      "source_id": "src_9cbb508bb34760770e6f"
    }
  ],
  "template_id": "tpl_cf4badd918adc47889b6",
  "training_eligibility": "review_required",
  "updated_at": "2026-08-12T14:00:38.704223Z",
  "validation": {
    "checked_at": "2026-08-12T14:00:38.704223Z",
    "errors": [],
    "valid": true
  }
}
