{
  "artifact_key": "src_4f8b27dce2b511b6af40",
  "artifact_paths": {
    "canonical": "artifacts/pilot/src_4f8b27dce2b511b6af40/canonical.json",
    "extraction": "artifacts/pilot/src_4f8b27dce2b511b6af40/extraction.json",
    "review": "artifacts/review-queue/review_282fc5dd0a69068d2420.json",
    "validation": "artifacts/pilot/src_4f8b27dce2b511b6af40/validation.json"
  },
  "created_at": "2026-08-12T14:00:38.640595Z",
  "decisions": {
    "classification": {
      "decided_at": null,
      "notes": "",
      "reviewer": null,
      "status": "pending"
    },
    "extraction": {
      "decided_at": null,
      "notes": "",
      "reviewer": null,
      "status": "pending"
    },
    "legal": {
      "decided_at": null,
      "notes": "",
      "reviewer": null,
      "status": "pending"
    },
    "privacy": {
      "decided_at": null,
      "notes": "",
      "reviewer": null,
      "status": "pending"
    },
    "sanitization": {
      "decided_at": null,
      "notes": "",
      "reviewer": null,
      "status": "pending"
    },
    "structure": {
      "decided_at": null,
      "notes": "",
      "reviewer": null,
      "status": "pending"
    }
  },
  "final_disposition": "pending",
  "initial_classification": "completed_contract",
  "required_reviews": [
    "classification",
    "extraction",
    "legal",
    "privacy",
    "sanitization",
    "structure"
  ],
  "review_coverage": "full",
  "review_record_id": "review_282fc5dd0a69068d2420",
  "reviewer": null,
  "revision": 0,
  "revision_history": [],
  "schema_version": "review-workspace-record-v1",
  "sources": [
    {
      "relative_path": "templates/Saudi arabia/1-0-نموذج-تعديل-اعادة-عقد-تعديل-(1-0).docx",
      "sha256": "611e4742941ac03c4238e302473bc1c65ee46eb274e9884287dec9bc24469c27",
      "source_id": "src_4f8b27dce2b511b6af40"
    }
  ],
  "template_id": "tpl_423391517d32e7cac567",
  "training_eligibility": "review_required",
  "updated_at": "2026-08-12T14:00:38.640595Z",
  "validation": {
    "checked_at": "2026-08-12T14:00:38.640595Z",
    "errors": [],
    "valid": true
  }
}
