{
  "artifact_key": "src_2c7d515ad5796238fd5a",
  "artifact_paths": {
    "canonical": "artifacts/pilot/src_2c7d515ad5796238fd5a/canonical.json",
    "extraction": "artifacts/pilot/src_2c7d515ad5796238fd5a/extraction.json",
    "review": "artifacts/review-queue/review_7289200f8476043c038f.json",
    "validation": "artifacts/pilot/src_2c7d515ad5796238fd5a/validation.json"
  },
  "created_at": "2026-08-12T14:00:38.375996Z",
  "decisions": {
    "classification": {
      "decided_at": null,
      "notes": "",
      "reviewer": null,
      "status": "pending"
    },
    "extraction": {
      "decided_at": null,
      "notes": "",
      "reviewer": null,
      "status": "pending"
    },
    "legal": {
      "decided_at": null,
      "notes": "",
      "reviewer": null,
      "status": "pending"
    },
    "privacy": {
      "decided_at": null,
      "notes": "",
      "reviewer": null,
      "status": "pending"
    },
    "sanitization": {
      "decided_at": null,
      "notes": "",
      "reviewer": null,
      "status": "pending"
    },
    "structure": {
      "decided_at": null,
      "notes": "",
      "reviewer": null,
      "status": "pending"
    }
  },
  "final_disposition": "pending",
  "initial_classification": "completed_contract",
  "required_reviews": [
    "classification",
    "extraction",
    "legal",
    "privacy",
    "sanitization",
    "structure"
  ],
  "review_coverage": "full",
  "review_record_id": "review_7289200f8476043c038f",
  "reviewer": null,
  "revision": 0,
  "revision_history": [],
  "schema_version": "review-workspace-record-v1",
  "sources": [
    {
      "relative_path": "templates/Oman/نموذج عقد عمل رسمي من وزارة العمل العمانية.pdf",
      "sha256": "7575a8752f47405dcce6b16f5c6dc2a92a27da91da95afd509209850dba9fb3c",
      "source_id": "src_2c7d515ad5796238fd5a"
    }
  ],
  "template_id": "tpl_4038901777245e748631",
  "training_eligibility": "review_required",
  "updated_at": "2026-08-12T14:00:38.375996Z",
  "validation": {
    "checked_at": "2026-08-12T14:00:38.375996Z",
    "errors": [],
    "valid": true
  }
}
