{
  "artifact_key": "src_5bda226150d98eb351a0",
  "artifact_paths": {
    "canonical": "artifacts/pilot/src_5bda226150d98eb351a0/canonical.json",
    "extraction": "artifacts/pilot/src_5bda226150d98eb351a0/extraction.json",
    "review": "artifacts/review-queue/review_fe7ad6589f62334cb2ab.json",
    "validation": "artifacts/pilot/src_5bda226150d98eb351a0/validation.json"
  },
  "created_at": "2026-08-12T14:00:38.890841Z",
  "decisions": {
    "classification": {
      "decided_at": null,
      "notes": "",
      "reviewer": null,
      "status": "pending"
    },
    "extraction": {
      "decided_at": null,
      "notes": "",
      "reviewer": null,
      "status": "pending"
    },
    "legal": {
      "decided_at": null,
      "notes": "",
      "reviewer": null,
      "status": "not_applicable"
    },
    "privacy": {
      "decided_at": null,
      "notes": "",
      "reviewer": null,
      "status": "not_applicable"
    },
    "sanitization": {
      "decided_at": null,
      "notes": "",
      "reviewer": null,
      "status": "not_applicable"
    },
    "structure": {
      "decided_at": null,
      "notes": "",
      "reviewer": null,
      "status": "not_applicable"
    }
  },
  "final_disposition": "pending",
  "initial_classification": "policy",
  "required_reviews": [
    "extraction",
    "classification"
  ],
  "review_coverage": "sampled_audit",
  "review_record_id": "review_fe7ad6589f62334cb2ab",
  "reviewer": null,
  "revision": 0,
  "revision_history": [],
  "schema_version": "review-workspace-record-v1",
  "sources": [
    {
      "relative_path": "templates/Émirats arabes unis/AML Compliance Policy.pdf",
      "sha256": "776eea2f584be7adc9bde775c9fe45be17911ac23325ccd349bd15d7c825e907",
      "source_id": "src_5bda226150d98eb351a0"
    }
  ],
  "template_id": "tpl_c4c29bc1f998c60ccc97",
  "training_eligibility": "excluded",
  "updated_at": "2026-08-12T14:00:38.890841Z",
  "validation": {
    "checked_at": "2026-08-12T14:00:38.890841Z",
    "errors": [],
    "valid": true
  }
}
