{
  "artifact_key": "src_a9a056f2cabad34b84c0",
  "artifact_paths": {
    "canonical": "artifacts/pilot/src_a9a056f2cabad34b84c0/canonical.json",
    "extraction": "artifacts/pilot/src_a9a056f2cabad34b84c0/extraction.json",
    "review": "artifacts/review-queue/review_ee7960e5015e501e1351.json",
    "validation": "artifacts/pilot/src_a9a056f2cabad34b84c0/validation.json"
  },
  "created_at": "2026-08-12T14:00:38.008759Z",
  "decisions": {
    "classification": {
      "decided_at": null,
      "notes": "",
      "reviewer": null,
      "status": "pending"
    },
    "extraction": {
      "decided_at": null,
      "notes": "",
      "reviewer": null,
      "status": "pending"
    },
    "legal": {
      "decided_at": null,
      "notes": "",
      "reviewer": null,
      "status": "pending"
    },
    "privacy": {
      "decided_at": null,
      "notes": "",
      "reviewer": null,
      "status": "pending"
    },
    "sanitization": {
      "decided_at": null,
      "notes": "",
      "reviewer": null,
      "status": "pending"
    },
    "structure": {
      "decided_at": null,
      "notes": "",
      "reviewer": null,
      "status": "pending"
    }
  },
  "final_disposition": "pending",
  "initial_classification": "completed_contract",
  "required_reviews": [
    "classification",
    "extraction",
    "legal",
    "privacy",
    "sanitization",
    "structure"
  ],
  "review_coverage": "full",
  "review_record_id": "review_ee7960e5015e501e1351",
  "reviewer": null,
  "revision": 0,
  "revision_history": [],
  "schema_version": "review-workspace-record-v1",
  "sources": [
    {
      "relative_path": "templates/Eygpte/Egypt-Definite-Employment-Agreement_.pdf",
      "sha256": "7075e5249793983b2cc29c7507389463fbb81ce9199ed63d984d00e55375d49d",
      "source_id": "src_a9a056f2cabad34b84c0"
    }
  ],
  "template_id": "tpl_e8df20c606d7cdc28c4e",
  "training_eligibility": "review_required",
  "updated_at": "2026-08-12T14:00:38.008759Z",
  "validation": {
    "checked_at": "2026-08-12T14:00:38.008759Z",
    "errors": [],
    "valid": true
  }
}
